{
  "contractVersion": "1.0.0",
  "manifestId": "55555555-5555-4555-8555-555555555555",
  "manifestVersion": "manifest-v1",
  "hashAlgorithm": "sha256-jcs",
  "contentHash": "0df6cbaf0fbdd869d46d3a72addd64bbdc48997711d5cf3fa426d02b905c0c8f",
  "projectionId": "80000000-0000-4000-8000-000000000001",
  "revocationEpoch": 0,
  "profileManifestId": "44444444-4444-4444-8444-444444444444",
  "sourceId": "11111111-1111-4111-8111-111111111111",
  "sourceVersion": "sha256:68fc3e599c5dcb5523a2d65c2d9586bfbec34d8b0dae0660659cf8b965533b13",
  "connectorId": "connectors/tabular-reader-v1",
  "connectorVersion": "1.0.0",
  "connectorCapabilityHash": "ccca6841c2a5d15058240039228b22351d60e6279bdcef5f1b78f687b7114ade",
  "policyHash": "bbbbbbbbbbbbbbbbbbbbbbbbbbbbbbbbbbbbbbbbbbbbbbbbbbbbbbbbbbbbbbbb",
  "authorizationScopeId": "authorized-assets",
  "taxonomyVersion": "1.0.0",
  "pipelineVersion": "1.0.0",
  "methodSetHash": "dddddddddddddddddddddddddddddddddddddddddddddddddddddddddddddddd",
  "evidenceCutoff": "2026-01-01T00:09:00Z",
  "generatedAt": "2026-01-01T00:10:00Z",
  "capabilities": [
    {
      "capabilityId": "work-record-change-timeline",
      "name": "Work Record Change Timeline",
      "description": "Analyze versioned changes for scoped work records.",
      "questionPatterns": [
        "how did a work record change",
        "show the change timeline",
        "compare record versions"
      ],
      "requiredAssets": [
        "work-records",
        "work-events"
      ],
      "requiredRelationships": [
        "work-records-to-work-events"
      ],
      "metricRefs": [],
      "resultShape": "timeline grouped by scoped work-record identity",
      "constraints": [
        "Use ScopeId and RecordId together.",
        "Use VersionNumber only for row ordering, not entity identity."
      ],
      "confidence": 0.9,
      "validationStatus": "hypothesis",
      "evidenceRefs": [
        "66666666-6666-4666-8666-666666666666",
        "77777777-7777-4777-8777-777777777777",
        "88888888-8888-4888-8888-888888888888",
        "99999999-9999-4999-8999-999999999999"
      ]
    }
  ],
  "retrievalHints": {
    "lexicalTerms": [
      "work record",
      "version",
      "change timeline"
    ],
    "semanticQueries": [
      "understand how an entity changed over time"
    ],
    "facets": [
      "domain:Work Operations",
      "role:entity-history"
    ],
    "graphEntryPoints": [
      "Work Record"
    ]
  },
  "warnings": [],
  "coverage": {
    "score": 0.85,
    "missingCapabilities": [
      "governed aggregate metrics"
    ]
  },
  "responsePolicy": {
    "maximumSerializedBytes": 10485760,
    "maximumTextCharacters": 4000,
    "defaultContentProvenance": "source-derived",
    "serviceGeneratedPathPatterns": [
      "/responsePolicy",
      "/traceId",
      "/coordinate",
      "/coverage",
      "/coverageReceipt",
      "/receipt",
      "/hashAlgorithm",
      "/resultHash"
    ],
    "sourceDerivedPathPatterns": [
      "/summary",
      "/assets/*/name",
      "/assets/*/purpose",
      "/assets/*/domain",
      "/assets/*/fields/*/businessMeaning",
      "/businessModel",
      "/modelPatterns",
      "/capabilities",
      "/retrievalHints",
      "/warnings",
      "/items/*/subject",
      "/items/*/summary",
      "/caveats/*/summary",
      "/conflicts",
      "/rows/*"
    ]
  }
}
